repo_url,repo_name,owner,framework,stars,forks,last_commit,language,cs_file_count,designer_cs_count,xaml_count,resx_count,complexity_tier,license,description,created_at
https://github.com/Amine-Smahi/C-Sharp-Learning-Journey,C-Sharp-Learning-Journey,Amine-Smahi,WinForms,186,48,2023-07-07,C#,170,69,11,46,Large,None,"Some of the projects i made when starting to learn c#, winfroms and wpf",2016-12-31
https://github.com/oozcitak/imagelistview,imagelistview,oozcitak,WinForms,179,72,2023-12-13,C#,61,9,0,7,Medium,Apache-2.0,A .NET listview control for image files with asynchronously loaded thumbnails.,2015-07-28
https://github.com/mlcsec/FormThief,FormThief,mlcsec,WinForms,177,31,2024-02-19,C#,36,15,2,14,Large,None,Spoofing desktop login applications with WinForms and WPF,2024-02-19
https://github.com/tewuapple/WinHtmlEditor,WinHtmlEditor,tewuapple,WinForms,176,57,2020-04-29,C#,36,10,0,10,Medium,None,one html editor for winform(.net),2012-06-28
https://github.com/Yuziquan/MyFileManager,MyFileManager,Yuziquan,WinForms,168,64,2018-10-20,C#,22,10,0,9,Medium,MIT,A self-developed customized file manager(file explorer).,2018-08-19
https://github.com/alex-oswald/WindowsFormsLifetime,WindowsFormsLifetime,alex-oswald,WinForms,165,24,2025-11-13,C#,25,4,0,4,Small,MIT,Windows Forms hosting extensions for the .NET Generic Host,2020-02-09
https://github.com/AdamsLair/winforms,winforms,AdamsLair,WinForms,163,66,2020-06-12,C#,105,5,0,4,Small,MIT,A collection of custom Controls for Windows.Forms,2014-03-23
https://github.com/SIDOVSKY/EBind,EBind,SIDOVSKY,WinForms,162,7,2021-07-18,C#,103,0,0,0,Small,Apache-2.0,"🔵 .NET Data Binding we deserve: concise, fast, feature-rich",2021-03-27
https://github.com/Cocotteseb/Krypton-OutlookGrid,Krypton-OutlookGrid,Cocotteseb,WinForms,161,66,2022-05-18,C#,50,8,0,8,Medium,MS-PL,"Krypton customized version of the .NET Winforms DataGridView (C#) that allows multi-grouping and multi-sorting. Featuring a TreeGrid mode, conditional formatting and additional custom columns.",2016-04-17
https://github.com/desjarlais/Scintilla.NET,Scintilla.NET,desjarlais,WinForms,161,36,2026-03-15,C#,109,4,0,3,Small,MIT,"A Windows Forms control, wrapper, and bindings for the Scintilla text editor.",2020-06-09
https://github.com/aesalazar/AsteroidsWasm,AsteroidsWasm,aesalazar,WinForms,159,30,2025-12-10,C#,70,1,7,0,Medium,None,"Collection of applications based on a single C# .NET Standard project running in:  Blazor Client (WebAssembly), Blazor Server, Electron, WPF, WinForms, Maui, WinUI3",2018-08-28
https://github.com/Empiree/DeftSharp.Windows.Input,DeftSharp.Windows.Input,Empiree,WinForms,144,29,2025-07-30,C#,108,0,2,0,Small,MIT,An open-source .NET library for managing native keyboard and mouse events in Windows OS.,2024-03-02
https://github.com/JasonLautzenheiser/trizbort,trizbort,JasonLautzenheiser,WinForms,144,36,2023-11-08,C#,129,17,0,16,Large,NOASSERTION,"Trizbort, the Interactive Fiction Mapper",2014-12-31
https://github.com/jadepeng/musicDecryptor,musicDecryptor,jadepeng,WinForms,138,41,2024-07-26,C#,13,3,0,2,Small,None,酷狗、网易等音乐缓存文件转mp3,2018-03-29
https://github.com/geomatics-io/ObjectListView,ObjectListView,geomatics-io,WinForms,137,66,2023-10-09,C#,151,22,0,21,Large,GPL-3.0,"ObjectListView is a .NET ListView wired on caffeine, guarana and steroids. More calmly, it is a C# wrapper around a .NET ListView, which makes the ListView much easier to use and teaches it lots of ne",2017-12-19
https://github.com/couchcoding/Logbert,Logbert,couchcoding,WinForms,132,33,2022-06-30,C#,209,51,0,50,Large,MIT,"Logbert is an advanced log message viewer for log4net, log4j and others.",2015-09-12
https://github.com/flexits/HotCornersWin,HotCornersWin,flexits,WinForms,131,2,2026-01-16,C#,24,5,0,4,Small,MIT,"macOS ""hot corners"" feature for Windows",2023-12-28
